{
    "$schema": "../../schemas/worldgen/material.json",
    "id": "o2",
    "tags": [
        "wg",
        "volatile"
    ],
    "abundance": {
        "min": 0.0005,
        "max": 0.001
    },
    "molar": 32,
    "greenhouse": 0.1,
    "colors": {
        "solid": {
            "r": 0.7686274509803922,
            "g": 0.9137254901960784,
            "b": 1
        },
        "liquid": {
            "r": 0.7686274509803922,
            "g": 0.9137254901960784,
            "b": 1
        },
        "gas": {
            "r": 0.7686274509803922,
            "g": 0.9137254901960784,
            "b": 1
        }
    },
    "phases": {
        "type": "triple",
        "triple": {
            "P": 152,
            "T": 54.36
        },
        "boil": [
            {
                "P": 5014000,
                "T": 154.78
            }
        ],
        "melt": [
            {
                "P": 10000000000,
                "T": 110
            }
        ],
        "subl": [
            {
                "P": 1,
                "T": 35
            }
        ]
    }
}
