{
    "$schema": "../../schemas/worldgen/material.json",
    "id": "co",
    "tags": [
        "wg",
        "volatile"
    ],
    "abundance": {
        "min": 0.01,
        "max": 0.04
    },
    "molar": 28,
    "greenhouse": 0.5,
    "colors": {
        "solid": {
            "r": 1,
            "g": 1,
            "b": 1
        },
        "liquid": {
            "r": 1,
            "g": 1,
            "b": 1
        },
        "gas": {
            "r": 1,
            "g": 1,
            "b": 1
        }
    },
    "phases": {
        "type": "triple",
        "triple": {
            "P": 15370,
            "T": 67.65
        },
        "boil": [
            {
                "P": 3452900,
                "T": 132.91
            }
        ],
        "melt": [
            {
                "P": 10000000000,
                "T": 110
            }
        ],
        "subl": [
            {
                "P": 1,
                "T": 10
            }
        ]
    }
}
