{
    "$schema": "../../schemas/worldgen/material.json",
    "id": "silicate",
    "tags": [
        "wg"
    ],
    "abundance": {
        "min": 0.9,
        "max": 0.99
    },
    "molar": 60,
    "colors": {
        "solid": {
            "r": 0.9372549019607843,
            "g": 0.9019607843137255,
            "b": 0.7490196078431373
        },
        "liquid": {
            "r": 0.9372549019607843,
            "g": 0.9019607843137255,
            "b": 0.7490196078431373
        },
        "gas": {
            "r": 0.9372549019607843,
            "g": 0.9019607843137255,
            "b": 0.7490196078431373
        }
    },
    "phases": {
        "type": "melt",
        "melt": [
            {
                "P": 100000,
                "T": 1200
            }
        ]
    }
}