{
    "$schema": "../../schemas/worldgen/material.json",
    "id": "h2o",
    "tags": [ "wg" ],
    "abundance": { "min": 0.2, "max": 0.6 },
    "molar": 18,
    "greenhouse": 0.5,
    "colors": {
        "solid": { "r": 0.4, "g": 0.8, "b": 1 },
        "liquid": { "r": 0.1, "g": 0.4, "b": 1 },
        "gas": { "r": 0.9, "g": 0.9, "b": 0.9 }
    },
    "phases": {
        "type": "triple",
        "triple": { "P": 611.657, "T": 273.16 },
        "subl": [ { "P": 0, "T": 213 }, { "P": 10, "T": 223 }, { "P": 100, "T": 250 } ],
        "melt": [ { "P": 1e7, "T": 273 }, { "P": 5e8, "T": 248 }, { "P": 1e9, "T": 280 }, { "P": 5e9, "T": 350 }, { "P": 1e10, "T": 670 } ],
        "boil": [ { "P": 1e5, "T": 373.15 }, { "P": 22.064e6, "T": 647 } ]
    }
}
