{
    "$schema": "../../schemas/worldgen/material.json",
    "id": "no2",
    "tags": [
        "wg",
        "volatile",
        "toxic"
    ],
    "abundance": {
        "min": 0.001,
        "max": 0.002
    },
    "molar": 46,
    "colors": {
        "solid": {
            "r": 0.9529411764705882,
            "g": 0.9529411764705882,
            "b": 0.9529411764705882
        },
        "liquid": {
            "r": 0.8156862745098039,
            "g": 0.6274509803921569,
            "b": 0.24313725490196078
        },
        "gas": {
            "r": 0.7137254901960784,
            "g": 0.41568627450980394,
            "b": 0.09803921568627451
        }
    },
    "phases": {
        "type": "triple",
        "triple": {
            "P": 187289,
            "T": 261.9
        },
        "boil": [
            {
                "P": 10132500,
                "T": 431.15
            }
        ],
        "melt": [
            {
                "P": 10000000000,
                "T": 300
            }
        ],
        "subl": [
            {
                "P": 1,
                "T": 150
            }
        ]
    }
}
