{
    "$schema": "../../schemas/worldgen/material.json",
    "id": "co2",
    "tags": [
        "wg",
        "volatile"
    ],
    "abundance": {
        "min": 0.05,
        "max": 0.1
    },
    "molar": 44,
    "greenhouse": 0.6,
    "colors": {
        "solid": {
            "r": 0.8274509803921568,
            "g": 0.8431372549019608,
            "b": 0.8117647058823529
        },
        "liquid": {
            "r": 0.8274509803921568,
            "g": 0.8431372549019608,
            "b": 0.8117647058823529
        },
        "gas": {
            "r": 0.8274509803921568,
            "g": 0.8431372549019608,
            "b": 0.8117647058823529
        }
    },
    "phases": {
        "type": "triple",
        "triple": {
            "P": 517770,
            "T": 216.58
        },
        "boil": [
            {
                "P": 7375450,
                "T": 304.13
            }
        ],
        "melt": [
            {
                "P": 10000000000,
                "T": 235
            }
        ],
        "subl": [
            {
                "P": 4,
                "T": 0
            }
        ]
    }
}
